{"case_id":"EQ-F10-AH-04","status":"abstention","risk_score":0,"reason_codes":["NO_CONTRADICTORY_EVIDENCE","VERDICT_SUPPORTED_BY_RECORDED_EVIDENCE"],"rubric_clause_ids":["R2","R3"],"evidence_references":[{"event_id":"E2","relation":"supports_current","claim":"The requirement remains unresolved, with no evidence establishing PASS or FAIL."},{"event_id":"E3","relation":"supports_current","claim":"The evaluator assigned UNDETERMINED based on the recorded evidence."},{"event_id":"E1","relation":"insufficient","claim":"The task statement alone does not establish whether duplicate transactions create one database record."}],"explanation":"The recorded trajectory contains no verified evidence that duplicate transactions produce one database record or that they fail to do so. Therefore, the current UNDETERMINED Verdict is consistent with the rubric, and no Risk Finding is supported.","abstention_reason":"Permitted evidence cannot support a Risk Finding that the current Verdict is wrong."}