{"case_id":"EQ-F08-AH-02","status":"abstention","risk_score":0,"reason_codes":["evidence_insufficient"],"rubric_clause_ids":["R3"],"evidence_references":[{"event_id":"E1","relation":"insufficient","claim":"The instruction identifies the checkpoint log to inspect but does not state its approval outcome."},{"event_id":"E2","relation":"insufficient","claim":"The event says a decisive approval state exists, but does not disclose whether it supports or contradicts PASS."},{"event_id":"E3","relation":"insufficient","claim":"The artifact records that inspection occurred, but not the inspection result."}],"explanation":"The permitted evidence does not reveal the decisive approval state or inspection result, so it cannot verify that the current PASS verdict may be wrong.","abstention_reason":"Insufficient evidence to assess whether PASS is incorrect."}