{"case_id":"smoke-case-1","status":"risk_finding","risk_score":97,"reason_codes":["REQUIRED_INTEGRATION_TEST_NOT_RECORDED","PASS_RATIONALE_INCOMPLETE"],"rubric_clause_ids":["R3"],"evidence_references":[{"event_id":"E4","relation":"supports_current","claim":"The required HTTP integration test has no recorded execution, indicating R3 may be unmet."},{"event_id":"E2","relation":"insufficient","claim":"Passing unit tests verifies R2 but does not establish that the required integration test ran."},{"event_id":"E3","relation":"contradicts_current","claim":"The completion summary says all required checks passed, but E4 records no execution of the required integration test."}],"explanation":"The PASS verdict may be wrong because verified trajectory evidence shows no recorded execution of the required HTTP integration test. Unit-test success alone does not satisfy R3. This is a risk finding, not an authoritative correction.","abstention_reason":null}