{"case_id":"EQ-F07-AH-02","status":"abstention","risk_score":0,"reason_codes":["INSUFFICIENT_EVIDENCE"],"rubric_clause_ids":["R3"],"evidence_references":[{"event_id":"E1","relation":"insufficient","claim":"The task instruction identifies the checkpoint log to inspect but does not provide its approval state."},{"event_id":"E2","relation":"insufficient","claim":"The event asserts that the log contains a decisive approval state, but does not disclose whether it supports or contradicts FAIL."},{"event_id":"E3","relation":"insufficient","claim":"The frozen artifact records an inspection result without exposing the result or enough detail to reassess the current Verdict."}],"explanation":"The permitted trajectory evidence does not reveal the decisive approval state or the frozen artifact's result, so it cannot verify that the current FAIL Verdict may be wrong.","abstention_reason":"The evidence is insufficient to support or contradict the current Verdict."}