{"case_id":"EQ-F10-AH-01","status":"risk_finding","risk_score":85,"reason_codes":["SUPPORTED_PASS_EVIDENCE","CURRENT_VERDICT_UNDERSCORES_EVIDENCE"],"rubric_clause_ids":["R1","R2"],"evidence_references":[{"event_id":"E2","relation":"contradicts_current","claim":"The tool result states that a digest-bound artifact and the active requirement prove the task passed."},{"event_id":"E3","relation":"supports_current","claim":"The evaluator recorded UNDETERMINED, but also characterized the summary as misleading."}],"explanation":"E2 indicates evidence establishing task completion and a passing outcome, which conflicts with the current UNDETERMINED verdict. E3 explains the evaluator's uncertainty but does not outweigh the stated pass evidence.","abstention_reason":null}