{"case_id":"EQ-F05-AH-03","status":"abstention","risk_score":0,"reason_codes":["no_contradictory_evidence"],"rubric_clause_ids":["R2","R3"],"evidence_references":[{"event_id":"E2","relation":"supports_current","claim":"The required artifact is absent and recorded verification supports FAIL."},{"event_id":"E3","relation":"supports_current","claim":"The evaluator assigned FAIL from the recorded evidence."}],"explanation":"The permitted evidence supports the current FAIL verdict and contains no verified contradiction indicating it may be wrong.","abstention_reason":"No evidence supports a Risk Finding that the current Verdict may be wrong."}