{"case_id":"EQ-F03-AH-02","status":"abstention","risk_score":0,"reason_codes":["NO_CONTRADICTORY_EVIDENCE","VERDICT_SUPPORTED"],"rubric_clause_ids":["R2","R3"],"evidence_references":[{"event_id":"E2","relation":"supports_current","claim":"The required artifact is absent, and recorded verification supports FAIL."},{"event_id":"E3","relation":"supports_current","claim":"Despite conflict and low confidence, the recorded evidence supports FAIL."}],"explanation":"Permitted evidence supports the current FAIL verdict and provides no verified contradiction establishing that it may be wrong.","abstention_reason":"No verified evidence contradicts the current Verdict."}