{"case_id":"EQ-F06-AH-04","status":"abstention","risk_score":0,"reason_codes":[],"rubric_clause_ids":["R3"],"evidence_references":[{"event_id":"E1","relation":"insufficient","claim":"The task statement alone does not establish PASS or FAIL."},{"event_id":"E2","relation":"supports_current","claim":"The recorded result explicitly says the requirement remains unresolved and contains no evidence establishing PASS or FAIL."},{"event_id":"E3","relation":"supports_current","claim":"The evaluator note records UNDETERMINED based on the available evidence."}],"explanation":"The permitted trajectory evidence supports retaining UNDETERMINED; it does not indicate that the current Verdict may be wrong.","abstention_reason":"No verified evidence contradicts the current UNDETERMINED Verdict."}