{"case_id":"EQ-F07-AH-02","status":"abstention","risk_score":0,"reason_codes":["NO_VERIFIED_CONTRADICTION"],"rubric_clause_ids":["R2","R3"],"evidence_references":[{"event_id":"E2","relation":"supports_current","claim":"The required artifact is absent and recorded verification supports FAIL."},{"event_id":"E3","relation":"supports_current","claim":"Despite evaluator conflict and low confidence, the note states that recorded evidence supports FAIL."}],"explanation":"The permitted evidence does not verify that the current FAIL verdict is wrong. The trajectory supports FAIL, while the evaluator conflict is not itself evidence establishing PASS.","abstention_reason":"No verified evidence contradicts the current Verdict."}