{"case_id":"EQ-F01-DEV-01","status":"abstention","risk_score":0,"reason_codes":["NO_VERIFIED_CONTRADICTION"],"rubric_clause_ids":["R3"],"evidence_references":[{"event_id":"E1","relation":"insufficient","claim":"The task instruction identifies the fixture to exercise but does not indicate that the FAIL verdict is wrong."},{"event_id":"E2","relation":"supports_current","claim":"The regression fixture contains a decisive failure mechanism, consistent with the current FAIL verdict."},{"event_id":"E3","relation":"supports_current","claim":"The frozen artifact records the exercise result, with no stated evidence contradicting FAIL."}],"explanation":"The permitted evidence does not verify that the current FAIL verdict may be wrong. It instead supports or fails to contradict the verdict.","abstention_reason":"No verified evidence indicates the current Verdict is incorrect."}