{"case_id":"EQ-F07-AH-02","status":"abstention","risk_score":0,"reason_codes":["insufficient_evidence"],"rubric_clause_ids":["R3"],"evidence_references":[{"event_id":"E1","relation":"insufficient","claim":"The task instruction identifies the checkpoint log to inspect but does not state its approval outcome."},{"event_id":"E2","relation":"insufficient","claim":"The tool result says the log contains a decisive approval state, but does not disclose whether that state supports or contradicts FAIL."},{"event_id":"E3","relation":"insufficient","claim":"The frozen artifact records that inspection occurred but does not provide the result."}],"explanation":"The permitted trajectory evidence does not reveal the decisive approval state or inspection result, so it cannot verify that the current FAIL verdict may be wrong.","abstention_reason":"Evidence is insufficient to support a Risk Finding."}