{"case_id":"EQ-F06-AH-01","status":"abstention","risk_score":0,"reason_codes":["evidence_insufficient"],"rubric_clause_ids":["R3"],"evidence_references":[{"event_id":"E1","relation":"insufficient","claim":"The task identifies the audit target but provides no audit outcome."},{"event_id":"E2","relation":"insufficient","claim":"The event asserts that a decisive repair sequence exists, but does not state its contents or conclusion."},{"event_id":"E3","relation":"insufficient","claim":"The artifact is said to record the audit result, but the result itself is not provided."}],"explanation":"The permitted events do not contain verifiable evidence that the current UNDETERMINED Verdict is wrong. Abstention is therefore required under R3.","abstention_reason":"Insufficient evidence to support a Risk Finding."}