{"case_id":"EQ-F08-AH-03","status":"abstention","risk_score":0,"reason_codes":["insufficient_evidence"],"rubric_clause_ids":["R3"],"evidence_references":[{"event_id":"E1","relation":"insufficient","claim":"The task instruction identifies a replay but does not state its observed outcome."},{"event_id":"E2","relation":"insufficient","claim":"The event says the replay contains a decisive result, but the result itself is not provided."},{"event_id":"E3","relation":"insufficient","claim":"The artifact is referenced but its recorded result is not included."}],"explanation":"The permitted trajectory does not reveal whether the replay passed or failed, so it cannot verify that the current FAIL Verdict may be wrong.","abstention_reason":"The decisive replay result is unavailable in the provided evidence."}