{"case_id":"EQ-F01-AH-04","status":"abstention","risk_score":5,"reason_codes":["INSUFFICIENT_EVIDENCE"],"rubric_clause_ids":["R2","R3"],"evidence_references":[{"event_id":"E1","relation":"insufficient","claim":"E1 states the task but provides no completion evidence."},{"event_id":"E2","relation":"supports_current","claim":"E2 explicitly states that the requirement remains unresolved and no evidence establishes PASS or FAIL."},{"event_id":"E3","relation":"supports_current","claim":"E3 records the evaluator's UNDETERMINED assignment."}],"explanation":"The permitted trajectory evidence does not establish PASS or FAIL and therefore supports, rather than undermines, the current UNDETERMINED Verdict under R3.","abstention_reason":"No verified evidence indicates that the current Verdict may be wrong."}