{"case_id":"EQ-F08-AH-03","status":"abstention","risk_score":0,"reason_codes":[],"rubric_clause_ids":[],"evidence_references":[{"event_id":"E2","relation":"supports_current","claim":"The required report-export artifact is absent, and recorded verification supports FAIL."},{"event_id":"E3","relation":"supports_current","claim":"The evaluator assigned FAIL based on the recorded evidence."},{"event_id":"E1","relation":"insufficient","claim":"The task requirement alone does not establish whether the implementation was completed."}],"explanation":"The available evidence supports the current FAIL verdict and provides no verified contradiction indicating that it may be wrong.","abstention_reason":"No verified evidence supports a Risk Finding that the current Verdict is wrong."}