{"case_id":"EQ-F04-AH-04","status":"abstention","risk_score":0,"reason_codes":["evidence_insufficient"],"rubric_clause_ids":["R3"],"evidence_references":[{"event_id":"E1","relation":"insufficient","claim":"The instruction identifies a comparison task but does not provide the artifact contents or comparison result."},{"event_id":"E2","relation":"insufficient","claim":"The event asserts that decisive evidence exists, but does not disclose that evidence."},{"event_id":"E3","relation":"insufficient","claim":"The frozen artifact is referenced without its substantive result."}],"explanation":"The permitted trajectory events do not contain enough substantive evidence to verify that the current UNDETERMINED Verdict is wrong.","abstention_reason":"The acceptance artifact's actual contents and comparison outcome are unavailable."}