{"case_id":"EQ-F10-AH-02","status":"abstention","risk_score":0,"reason_codes":[],"rubric_clause_ids":[],"evidence_references":[{"event_id":"E1","relation":"insufficient","claim":"States the task but provides no result evidence."},{"event_id":"E2","relation":"supports_current","claim":"Reports that the required artifact and independent check support PASS, without details sufficient to independently verify them."},{"event_id":"E3","relation":"supports_current","claim":"Records the evaluator's PASS assignment."}],"explanation":"The permitted evidence does not verify that the current PASS verdict is wrong. E2 and E3 support PASS, but E2 lacks underlying artifact details for independent validation.","abstention_reason":"No verified evidence indicates that the current Verdict may be wrong."}