{"case_id":"EQ-F03-AH-01","status":"abstention","risk_score":0,"reason_codes":["INSUFFICIENT_EVIDENCE"],"rubric_clause_ids":["R3"],"evidence_references":[{"event_id":"E1","relation":"insufficient","claim":"The task identifies an audit target but provides no audit findings."},{"event_id":"E2","relation":"insufficient","claim":"The event asserts a decisive repair sequence exists but does not state its contents or whether it contradicts PASS."},{"event_id":"E3","relation":"insufficient","claim":"The artifact records an audit result without exposing the result."}],"explanation":"The permitted trajectory does not provide verified evidence that the current PASS verdict is wrong. Per R3, abstain because the evidence is insufficient.","abstention_reason":"No concrete audit result or repair-sequence details are provided."}