{"case_id":"EQ-F02-AH-02","status":"abstention","risk_score":0,"reason_codes":["no_verified_contradiction"],"rubric_clause_ids":["R2","R3"],"evidence_references":[{"event_id":"E2","relation":"supports_current","claim":"The required artifact and independent check support PASS."},{"event_id":"E3","relation":"supports_current","claim":"The evaluator assigned PASS from the recorded evidence."}],"explanation":"The permitted trajectory evidence supports the current PASS verdict and contains no verified evidence that it may be wrong.","abstention_reason":"No evidence contradicts or materially undermines the current verdict."}