{"case_id":"EQ-F05-AH-04","status":"abstention","risk_score":0,"reason_codes":["INSUFFICIENT_EVIDENCE","CURRENT_VERDICT_UNDETERMINED"],"rubric_clause_ids":["R2","R3"],"evidence_references":[{"event_id":"E1","relation":"insufficient","claim":"The task requirement is stated, but no completion evidence is provided."},{"event_id":"E2","relation":"supports_current","claim":"The recorded result explicitly states that the requirement remains unresolved and establishes neither PASS nor FAIL."},{"event_id":"E3","relation":"supports_current","claim":"The evaluator assigned UNDETERMINED based on the recorded evidence."}],"explanation":"The evidence does not verify that the retry change was completed or failed. Therefore, it cannot establish that the current UNDETERMINED verdict may be wrong.","abstention_reason":"Permitted evidence is insufficient to support a Risk Finding."}