{"case_id":"EQ-F09-AH-03","status":"abstention","risk_score":0,"reason_codes":["INSUFFICIENT_EVIDENCE"],"rubric_clause_ids":["R3"],"evidence_references":[{"event_id":"E1","relation":"insufficient","claim":"The task instruction identifies the required replay but does not report its outcome."},{"event_id":"E2","relation":"insufficient","claim":"The event states that a decisive replay result exists, but does not provide that result."},{"event_id":"E3","relation":"insufficient","claim":"The artifact is said to record the replay result, but its contents are not provided."}],"explanation":"The permitted trajectory does not reveal the decisive observed result, so it cannot verify that the current FAIL verdict may be wrong.","abstention_reason":"The replay outcome and frozen artifact contents are unavailable."}